<?xml version="1.0" encoding="UTF-8"?>
<Navigations xmlns="http://www.platform.com/gui/pmc_navigation_tab"
	xmlns:xsi="http://www.w3.org/2001/XMLSchema-instance"
	xsi:schemaLocation="http://www.platform.com/gui/pmc_navigation_tab pmc_navigation_tab.xsd">

	<Navigation id="resources" label="@{pmc.navigation.tab.resources.label}"
		status="display" icon="images/tabicons/pcmcluster.gif" layoutSourceId=""
		tabGroup="" highlightTabId="" url="" aclResource="" aclPermission="1"
		helpGroupId="helpresources">
		<Handler id="resourceTrigger" type="menu">
			<Datasource>resourceTreeSource</Datasource>
			<SelectNodeId>hostListIcon</SelectNodeId>
		</Handler>
	</Navigation>

	<Navigation id="system" label="@{pmc.navigation.tab.settings.label}"
		status="display" icon="images/tabicons/pmcusers.gif" aclResource=""
		aclPermission="1" helpGroupId="helpsystem">
		<Handler id="systemTrigger" type="menu">
			<Datasource>systemTreeSource</Datasource>
			<SelectNodeId>entitlement</SelectNodeId>
		</Handler>
	</Navigation>

	<Navigation id="eventAndReport" label="@{pmc.navigation.tab.reportLog.label}"
		status="display" icon="images/tabicons/pmcusers.gif" layoutSourceId=""
		tabGroup="" highlightTabId="" url="" aclResource="" aclPermission="1"
		helpGroupId="helpeventandreport">
		<Handler id="eventAndReportTrigger" type="menu">
			<Datasource>eventAndReportTreeSource</Datasource>
			<SelectNodeId>standardReport</SelectNodeId>
		</Handler>
	</Navigation>

	<Navigation id="eventAndReportExpress" label="@{pmc.navigation.tab.Logs.label}"
		status="display" icon="images/tabicons/pmcusers.gif" layoutSourceId=""
		tabGroup="" highlightTabId="" url="" aclResource="" aclPermission="1"
		helpGroupId="helpeventandreport">
		<Handler id="eventAndReportTrigger" type="menu">
			<Datasource>eventAndReportTreeSource</Datasource>
			<SelectNodeId>standardReport</SelectNodeId>
		</Handler>
	</Navigation>

	<Navigation id="harvesting" label="@{pmc.navigation.tab.harvesting.label}"
		status="display" icon="images/tabicons/pmcusers.gif" aclResource=""
		aclPermission="1" helpGroupId="helpharvesting">
		<Handler id="harvestTrigger" type="menu">
			<Datasource>harvesting</Datasource>
			<SelectNodeId>harvestingHost</SelectNodeId>
		</Handler>
	</Navigation>
	
	<Navigation id="integration" label="@{pmc.navigation.tab.integration.label}"
		status="display" icon="images/tabicons/pmcusers.gif" aclResource=""
		aclPermission="1" helpGroupId="helpintegration">
		<Handler id="integrationTrigger" type="menu">
			<Datasource>integration</Datasource>
			<SelectNodeId>yarn</SelectNodeId>
		</Handler>
	</Navigation>
		
	<Navigation id="dashboard" label="@{pmc.navigation.tab.dashboard.label}"
		status="display" icon="images/tabicons/pmcusers.gif" aclResource=""
		aclPermission="1" helpGroupId="" cssClass="dock">
		<Handler id="dashboardTrigger" type="menu">
			<Datasource>symDashboardMenu</Datasource>
			<SelectNodeId>symDashboard</SelectNodeId>
		</Handler>
	</Navigation>
	
</Navigations>
